{
  "version": 2,
  "uid": "poster-1770319435984",
  "front": {
    "title": "Perplexity AI Ask Anything"
  },
  "back": {
    "layout": "auto",
    "links": [
      {
        "type": "external",
        "label": "Open Website",
        "url": "https://www.perplexity.ai/?s=e",
        "primary": true
      }
    ],
    "text": "An AI-powered answer engine that provides accurate and cited responses to your questions."
  },
  "meta": {
    "modified": "2026-02-08T21:36:58.119Z",
    "categories": [
      "externalWeb"
    ],
    "created": "2026-02-08T17:56:24.611Z"
  },
  "type": "poster-v2"
}