{
  "version": 2,
  "uid": "poster-1770319435949",
  "front": {
    "title": "Bolt"
  },
  "back": {
    "layout": "auto",
    "links": [
      {
        "type": "external",
        "label": "Open Website",
        "url": "https://bolt.new/",
        "primary": true
      }
    ],
    "text": "Vibe Coding level 2"
  },
  "meta": {
    "modified": "2026-02-08T21:36:58.096Z",
    "categories": [
      "Contemporary_Tools"
    ],
    "created": "2026-02-08T17:56:24.596Z"
  },
  "type": "poster-v2"
}