{
  "version": 2,
  "uid": "poster-1770319435987",
  "front": {
    "title": "Suno"
  },
  "back": {
    "layout": "auto",
    "links": [
      {
        "type": "external",
        "label": "Open Website",
        "url": "https://www.suno.ai/",
        "primary": true
      }
    ],
    "text": "Suno - AI music slop."
  },
  "meta": {
    "modified": "2026-02-08T21:36:58.123Z",
    "categories": [
      "externalWeb"
    ],
    "created": "2026-02-08T17:56:24.613Z"
  },
  "type": "poster-v2"
}