{
  "version": 2,
  "uid": "poster-1770319436017",
  "front": {
    "title": "Diderot"
  },
  "back": {
    "layout": "image-top",
    "text": "co-founder, chief editor, and contributor to the Encyclop√©die",
    "image": {
      "src": "images/originals/Diderot.webp",
      "alt": "Diderot",
      "position": "top"
    }
  },
  "meta": {
    "modified": "2026-02-08T21:22:07.530Z",
    "categories": [
      "Philosophers"
    ],
    "created": "2026-02-08T17:56:24.629Z"
  },
  "type": "poster-v2"
}