{
  "version": 2,
  "uid": "poster-1770319436076",
  "front": {
    "title": "A 16Z March 2025"
  },
  "back": {
    "layout": "image-top",
    "image": {
      "src": "images/originals/01_Top_Gen_AI_2025_Web_Top_50_List_Inline_1.webp",
      "alt": "A 16Z March 2025",
      "position": "top"
    },
    "text": "Overview for A 16Z March 2025 in Voronoi. Details coming soon."
  },
  "meta": {
    "modified": "2026-02-08T21:22:07.567Z",
    "categories": [
      "Voronoi"
    ],
    "created": "2026-02-08T17:56:24.681Z"
  },
  "type": "poster-v2"
}