{
  "version": 2,
  "uid": "poster-709",
  "front": {
    "title": "Warren Mc Culloch",
    "chronology": {
      "epochStart": 1898,
      "epochEnd": 1969,
      "epochEvents": [
        {
          "year": 1934,
          "name": "Research at Yale (Neurophysiology)"
        },
        {
          "year": 1941,
          "name": "Met Walter Pitts"
        },
        {
          "year": 1943,
          "name": "McCulloch-Pitts Neuron Paper"
        },
        {
          "year": 1952,
          "name": "Moved to MIT (RLE)"
        },
        {
          "year": 1960,
          "name": "Embodiments of Mind (Published 1965)"
        }
      ]
    }
  },
  "back": {
    "layout": "auto",
    "text": "Warren McCulloch (1898-1969) was an American neurophysiologist and cybernetician whose work provided foundational insights into the computational nature of the brain. Trained in philosophy, psychology, and medicine, McCulloch sought to understand thought processes in terms of brain mechanisms. His most influential contribution came in collaboration with Walter Pitts.\n\nTheir 1943 paper, \"A Logical Calculus of the Ideas Immanent in Nervous Activity,\" introduced the McCulloch-Pitts neuron, a mathematical abstraction of a biological neuron. They demonstrated that networks of these simple threshold logic units could theoretically perform any computation that a Turing machine could, suggesting that the brain itself could be understood as a computational device. This work was profoundly influential, laying the groundwork for neural network research in AI, computational neuroscience, and cybernetics. McCulloch was a central figure in the Macy Conferences on cybernetics, fostering interdisciplinary dialogue about mind, machines, and control systems."
  },
  "meta": {
    "modified": "2026-02-08T21:22:07.546Z",
    "categories": [
      "Pioneers"
    ],
    "created": "2026-02-08T17:56:24.654Z"
  },
  "type": "poster-v2"
}