{
  "version": 2,
  "uid": "poster-1770319436079-5xnkg7u57",
  "front": {
    "title": "02 Top Gen AI 2025 Apps Top 50 List Inline"
  },
  "back": {
    "layout": "image-top",
    "image": {
      "src": "images/originals/02-Top-Gen-AI-2025-Apps-Top-50-List-Inline.png",
      "alt": "02 Top Gen AI 2025 Apps Top 50 List Inline",
      "position": "top"
    },
    "text": "Overview for 02 Top Gen AI 2025 Apps Top 50 List Inline in Voronoi. Details coming soon."
  },
  "meta": {
    "modified": "2026-02-08T21:22:07.569Z",
    "categories": [
      "Voronoi"
    ],
    "created": "2026-02-08T17:56:24.682Z"
  },
  "type": "poster-v2"
}