{
  "version": 2,
  "uid": "poster-mlb08xa2aalllna9c",
  "front": {
    "title": "Grok",
    "subtitle": "The naughty one",
    "chronology": {
      "epochStart": 2023,
      "epochEvents": [
        {
          "year": 2026,
          "name": "Grok Imagine"
        }
      ]
    }
  },
  "back": {
    "layout": "auto",
    "image": {
      "src": "images/originals/grok_Imagine.webp",
      "alt": "",
      "position": "top"
    },
    "links": [
      {
        "type": "external",
        "label": "Imagine",
        "url": "https://grok.com/imagine"
      }
    ]
  },
  "meta": {
    "created": "2026-02-06T14:28:08.591Z",
    "modified": "2026-02-06T15:48:01.129Z",
    "categories": [
      "Philosophers"
    ]
  }
}