{
  "version": 2,
  "uid": "poster-1770319435977",
  "front": {
    "title": "Eleven Labs"
  },
  "back": {
    "layout": "auto",
    "links": [
      {
        "type": "external",
        "label": "Open Website",
        "url": "https://elevenlabs.io/app/voice-lab",
        "primary": true
      }
    ],
    "text": "AI Voice generation"
  },
  "meta": {
    "modified": "2026-02-08T21:36:58.104Z",
    "categories": [
      "externalWeb"
    ],
    "created": "2026-02-08T17:56:24.608Z"
  },
  "type": "poster-v2"
}