{
  "version": 2,
  "uid": "poster-809",
  "front": {
    "title": "Rudolf Carnap",
    "chronology": {
      "epochStart": 1891,
      "epochEnd": 1970,
      "epochEvents": [
        {
          "year": 1922,
          "name": "Joined the Vienna Circle"
        },
        {
          "year": 1928,
          "name": "The Logical Structure of the World"
        },
        {
          "year": 1934,
          "name": "The Logical Syntax of Language"
        },
        {
          "year": 1936,
          "name": "Testability and Meaning"
        },
        {
          "year": 1950,
          "name": "Logical Foundations of Probability"
        }
      ]
    }
  },
  "back": {
    "layout": "auto",
    "text": "Rudolf Carnap (1891-1970) was a German-American philosopher who played a central role in the logical positivist movement and the development of formal logic. Through works like \"The Logical Structure of the World\" (1928) and \"The Logical Syntax of Language\" (1934), Carnap championed a strongly formalized approach to philosophy that sought to reconstruct philosophical questions and scientific theories in precise logical terms.\n\nCarnap's work on language frameworks, logic, and probability laid crucial groundwork for areas of AI research. His focus on formal analysis of language and thought via syntactic and semantic rules influenced early AI approaches that formalized reasoning. His work on inductive logic and probability—developed in \"Logical Foundations of Probability\" (1950)—anticipated methods in probabilistic reasoning and automated induction. Perhaps most significant was Carnap's insistence that philosophical problems could be resolved through the construction of formal languages with explicit rules, a view that resonated with AI's aspiration to formalize intelligence in computational systems. His methodological principle of tolerance toward different logical systems also foreshadowed discussions about multiple approaches to knowledge representation in AI."
  },
  "meta": {
    "modified": "2026-02-08T21:22:07.529Z",
    "categories": [
      "Philosophers"
    ],
    "created": "2026-02-08T17:56:24.627Z"
  },
  "type": "poster-v2"
}