{
  "version": 2,
  "uid": "poster-1770319435963",
  "front": {
    "title": "Manus"
  },
  "back": {
    "layout": "auto",
    "links": [
      {
        "type": "external",
        "label": "Open Website",
        "url": "https://manus.im/",
        "primary": true
      }
    ],
    "text": "the latest in AI agents"
  },
  "meta": {
    "modified": "2026-02-08T21:36:58.113Z",
    "categories": [
      "Contemporary_Tools"
    ],
    "created": "2026-02-08T17:56:24.602Z"
  },
  "type": "poster-v2"
}