{
  "version": 2,
  "uid": "poster-1770319435976",
  "front": {
    "title": "Deep Site"
  },
  "back": {
    "layout": "auto",
    "links": [
      {
        "type": "external",
        "label": "Open Website",
        "url": "https://huggingface.co/spaces/victor/deepsite-gallery/",
        "primary": true
      }
    ],
    "text": "A gallery of AI-generated tools."
  },
  "meta": {
    "modified": "2026-02-08T21:36:58.101Z",
    "categories": [
      "externalWeb"
    ],
    "created": "2026-02-08T17:56:24.608Z"
  },
  "type": "poster-v2"
}