{
  "version": 2,
  "type": "poster-v2",
  "uid": "poster-mleam84vowjehbmwi",
  "front": {
    "title": "Chat GPT Open AI"
  },
  "back": {
    "layout": "auto",
    "text": "A conversational AI model that understands and generates human-like text for a wide range of tasks.",
    "image": {
      "src": "images/originals/Wittgenstein.webp",
      "alt": "",
      "position": "top"
    },
    "images": [
      {
        "src": "images/originals/Wittgenstein.webp",
        "alt": ""
      },
      {
        "src": "images/originals/USsoftwareDevJObs.webp",
        "alt": ""
      }
    ],
    "links": [
      {
        "type": "external",
        "label": "Open Website",
        "url": "https://chatgpt.com/",
        "primary": true
      }
    ]
  },
  "meta": {
    "created": "2026-02-08T17:56:24.607Z",
    "modified": "2026-02-08T22:06:38.767Z",
    "tags": [
      "AI Lab",
      "Frontier models"
    ],
    "categories": [
      "Competitors"
    ]
  }
}