{
  "version": 2,
  "uid": "poster-20",
  "front": {
    "title": "Auto<br>Regression"
  },
  "back": {
    "layout": "auto",
    "text": "Auto Regression"
  },
  "meta": {
    "modified": "2026-02-08T21:22:07.548Z",
    "categories": [
      "Topics"
    ],
    "created": "2026-02-08T17:56:24.657Z"
  },
  "type": "poster-v2"
}