{
  "version": 2,
  "uid": "poster-1770319435990",
  "front": {
    "title": "Wikipedia The Free Encyclopedia"
  },
  "back": {
    "layout": "auto",
    "links": [
      {
        "type": "external",
        "label": "Open Website",
        "url": "https://www.wikipedia.org/",
        "primary": true
      }
    ],
    "text": "The world's largest free online encyclopedia that anyone can edit."
  },
  "meta": {
    "modified": "2026-02-08T21:36:58.129Z",
    "categories": [
      "externalWeb"
    ],
    "created": "2026-02-08T17:56:24.615Z"
  },
  "type": "poster-v2"
}