{
  "version": 2,
  "uid": "poster-1770319435979",
  "front": {
    "title": "Hey Gen"
  },
  "back": {
    "layout": "auto",
    "links": [
      {
        "type": "external",
        "label": "Open Website",
        "url": "https://heygen.com/",
        "primary": true
      }
    ],
    "text": "HeyGen - AI Avatars."
  },
  "meta": {
    "modified": "2026-02-08T21:36:58.108Z",
    "categories": [
      "externalWeb"
    ],
    "created": "2026-02-08T17:56:24.609Z"
  },
  "type": "poster-v2"
}