{
  "version": 2,
  "uid": "poster-1770319436084-e9mba74lt",
  "front": {
    "title": "Pew Survey"
  },
  "back": {
    "layout": "image-top",
    "image": {
      "src": "images/originals/pewSurvey.png",
      "alt": "Pew Survey",
      "position": "top"
    },
    "text": "Overview for Pew Survey in Voronoi. Details coming soon."
  },
  "meta": {
    "modified": "2026-02-08T21:22:07.574Z",
    "categories": [
      "Voronoi"
    ],
    "created": "2026-02-08T17:56:24.683Z"
  },
  "type": "poster-v2"
}