{
  "version": 2,
  "uid": "poster-1770319435980",
  "front": {
    "title": "LM Studio"
  },
  "back": {
    "layout": "auto",
    "links": [
      {
        "type": "external",
        "label": "Open Website",
        "url": "https://www.lmstudio.ai/",
        "primary": true
      }
    ],
    "text": "Rum AI models on you local machine."
  },
  "meta": {
    "modified": "2026-02-08T21:36:58.112Z",
    "categories": [
      "externalWeb"
    ],
    "created": "2026-02-08T17:56:24.610Z"
  },
  "type": "poster-v2"
}