{
  "version": 2,
  "uid": "poster-1770319435951",
  "front": {
    "title": "Character AI"
  },
  "back": {
    "layout": "auto",
    "links": [
      {
        "type": "external",
        "label": "Open Website",
        "url": "https://character.ai/",
        "primary": true
      }
    ],
    "text": "find a friend"
  },
  "meta": {
    "modified": "2026-02-08T21:36:58.097Z",
    "categories": [
      "Contemporary_Tools"
    ],
    "created": "2026-02-08T17:56:24.596Z"
  },
  "type": "poster-v2"
}